{
  "schemaVersion": 1,
  "startRegionId": "duty-free-entrance",
  "regions": [
    {
      "id": "duty-free-entrance",
      "nameKey": "region.dutyFreeEntrance.name",
      "kind": "hub",
      "enabledInMvp": true
    },
    {
      "id": "security-check",
      "nameKey": "region.securityCheck.name",
      "kind": "hub",
      "enabledInMvp": true
    },
    {
      "id": "departure-hall",
      "nameKey": "region.departureHall.name",
      "kind": "hub",
      "enabledInMvp": true
    },
    {
      "id": "information-core",
      "nameKey": "region.informationCore.name",
      "kind": "service",
      "enabledInMvp": true
    },
    {
      "id": "airport-facilities",
      "nameKey": "region.airportFacilities.name",
      "kind": "service",
      "enabledInMvp": true
    },
    {
      "id": "duty-free-central",
      "nameKey": "region.dutyFreeCentral.name",
      "kind": "hub",
      "enabledInMvp": true
    },
    {
      "id": "shop-beauty-01",
      "nameKey": "region.shopBeauty01.name",
      "kind": "shop",
      "enabledInMvp": true
    },
    {
      "id": "shop-liquor-food-01",
      "nameKey": "region.shopLiquorFood01.name",
      "kind": "shop",
      "enabledInMvp": true
    },
    {
      "id": "shop-gift-01",
      "nameKey": "region.shopGift01.name",
      "kind": "shop",
      "enabledInMvp": true
    },
    {
      "id": "shop-travel-01",
      "nameKey": "region.shopTravel01.name",
      "kind": "future",
      "enabledInMvp": false
    }
  ],
  "connections": [
    {
      "id": "entrance-security",
      "fromRegionId": "duty-free-entrance",
      "toRegionId": "security-check",
      "bidirectional": true,
      "transition": "fade"
    },
    {
      "id": "security-departure-hall",
      "fromRegionId": "security-check",
      "toRegionId": "departure-hall",
      "bidirectional": true,
      "transition": "fade"
    },
    {
      "id": "hall-information",
      "fromRegionId": "departure-hall",
      "toRegionId": "information-core",
      "bidirectional": true,
      "transition": "fade"
    },
    {
      "id": "hall-facilities",
      "fromRegionId": "departure-hall",
      "toRegionId": "airport-facilities",
      "bidirectional": true,
      "transition": "fade"
    },
    {
      "id": "hall-duty-free",
      "fromRegionId": "departure-hall",
      "toRegionId": "duty-free-central",
      "bidirectional": true,
      "transition": "fade"
    },
    {
      "id": "central-beauty",
      "fromRegionId": "duty-free-central",
      "toRegionId": "shop-beauty-01",
      "bidirectional": true,
      "transition": "fade"
    },
    {
      "id": "central-liquor-food",
      "fromRegionId": "duty-free-central",
      "toRegionId": "shop-liquor-food-01",
      "bidirectional": true,
      "transition": "fade"
    },
    {
      "id": "central-gift",
      "fromRegionId": "duty-free-central",
      "toRegionId": "shop-gift-01",
      "bidirectional": true,
      "transition": "fade"
    }
  ]
}
